{
  "facts_used": [],
  "unknowns": [],
  "client_questions": [],
  "backend_tasks": [],
  "frontend_tasks": [
    {
      "task": "Pass selected hierarchyAgent and date range to report endpoint",
      "status": "ready",
      "reason": "",
      "depends_on": []
    }
  ],
  "database_considerations": [
    {
      "item": "Source tables for the report",
      "status": "blocked",
      "reason": "Not provided by client",
      "depends_on": []
    },
    {
      "item": "Exact field name for the metric to be summed",
      "status": "blocked",
      "reason": "Not provided by client",
      "depends_on": []
    }
  ],
  "test_cases": [
    {
      "name": "Basic query test",
      "status": "blocked",
      "given": "companyCode = <company_code>, hierarchyAgent = <hierarchy_agent>, startDate = <start_date>, endDate = <end_date>",
      "expected": "Sum of metric field for specified company and hierarchy agent within date range",
      "depends_on": []
    }
  ],
  "hallucination_checks": [
    {
      "check": "Source tables for the report are known",
      "result": "blocked",
      "notes": "Source tables not provided by client"
    },
    {
      "check": "Exact metric field name is known",
      "result": "blocked",
      "notes": "Exact metric field name not provided by client"
    }
  ]
}